{
    "fileName": "ChatBubbleIcon",
    "name": "Chat Bubble",
    "tags": [
        "chat",
        "bubble",
        "message",
        "communication"
    ],
    "categories": [
        "interface",
        "communication"
    ],
    "contributors": [
        {
            "name": "Radix UI",
            "github": "radix-ui"
        }
    ],
    "keywords": [
        "chat",
        "bubble",
        "message",
        "communication"
    ]
}