{
    "fileName": "BoxIcon",
    "name": "Box",
    "tags": [
        "box",
        "container",
        "layout"
    ],
    "categories": [
        "interface",
        "layout"
    ],
    "contributors": [
        {
            "name": "Radix UI",
            "github": "radix-ui"
        }
    ],
    "keywords": [
        "box",
        "container",
        "layout"
    ]
}