{
    "fileName": "BookmarkIcon",
    "name": "Bookmark",
    "tags": [
        "bookmark",
        "save",
        "favorite",
        "marker"
    ],
    "categories": [
        "interface",
        "status"
    ],
    "contributors": [
        {
            "name": "Radix UI",
            "github": "radix-ui"
        }
    ],
    "keywords": [
        "bookmark",
        "save",
        "favorite",
        "marker"
    ]
}