{
    "fileName": "BlendingModeIcon",
    "name": "Blending Mode",
    "tags": [
        "blending mode",
        "blend mode",
        "blend",
        "mode"
    ],
    "categories": [
        "interface",
        "development"
    ],
    "contributors": [
        {
            "name": "Radix UI",
            "github": "radix-ui"
        }
    ],
    "keywords": [
        "blending mode",
        "blend mode",
        "blend",
        "mode"
    ]
}