{
    "fileName": "CaretRightIcon",
    "name": "Caret Right",
    "tags": [
        "caret",
        "right",
        "arrow",
        "navigation"
    ],
    "categories": [
        "interface",
        "navigation"
    ],
    "contributors": [
        {
            "name": "Radix UI",
            "github": "radix-ui"
        }
    ],
    "keywords": [
        "caret",
        "right",
        "arrow",
        "navigation"
    ]
}