{
    "fileName": "BorderDashedIcon",
    "name": "Border Dashed",
    "tags": [
        "border",
        "dashed",
        "line",
        "divider"
    ],
    "categories": [
        "interface",
        "layout"
    ],
    "contributors": [
        {
            "name": "Radix UI",
            "github": "radix-ui"
        }
    ],
    "keywords": [
        "border",
        "dashed",
        "line",
        "divider"
    ]
}