{
    "fileName": "BorderAllIcon",
    "name": "Border All",
    "tags": [
        "border",
        "all",
        "square",
        "box"
    ],
    "categories": [
        "interface",
        "layout"
    ],
    "contributors": [
        {
            "name": "Radix UI",
            "github": "radix-ui"
        }
    ],
    "keywords": [
        "border",
        "all",
        "square",
        "box"
    ]
}